{
  "id": "pcc-esol-digital-workbook",
  "type": "LearningResource",
  "title": "A Digital Workbook for Beginning ESOL",
  "authors": ["Eric Dodson", "Davida Jordan", "Tim Krause"],
  "publisher": "Portland Community College / Open Oregon Educational Resources",
  "url": "https://openoregon.pressbooks.pub/esol23/",
  "license": "CC BY 4.0",
  "licenseUrl": "https://creativecommons.org/licenses/by/4.0/",
  "contentType": ["workbook", "interactive-exercises"],
  "levels": ["beginner"],
  "subjects": ["ESOL", "English language"],
  "reuseStatus": "approved",
  "provenanceNotes": "Book-level license is CC BY 4.0 'except where otherwise noted'; embedded items carry their own licenses and are dispositioned per item (REUSE/ADAPT → EXTERNAL_EMBED → LINK_ONLY → OMIT). Per-item dispositions for the Greetings chapter (chapter-1-2): H5P 'Greetings 01' fill-in-the-blank dialogue — CC0 1.0 by Tim Krause → ADAPT-eligible (evidence retained; previously used in the superseded lesson pcc-esol-l1m1-greetings). H5P 'Greetings 02' memory game — CC0 but per-image copyrights unverified → LINK_ONLY (original host's embed endpoint blocked cross-origin by CloudFront — verified live 2026-10-03). YouTube 'Hello. How are you?' (AzES-nhQFzk) — third-party → EXTERNAL_EMBED-eligible via official player. YouTube 'More Greetings' (uqgKvNxhCvQ) — third-party → LINK_ONLY. H5P 'Useful Expressions' and 'Greetings Extra' — license 'U' undisclosed → LINK_ONLY via chapter link. Current role: exercise-mechanics reference for se-a1-meet-someone — its greeting content teaches 'How are you?' (a later capability).",
  "verifiedAt": "2026-10-03",
  "verifiedBy": "Devin",
  "adaptationLog": [
    {
      "item": "Greetings chapter — H5P 'Level 01 Module 01 Greetings 01' (fill-in-the-blank greeting dialogue)",
      "itemUrl": "https://openoregon.pressbooks.pub/esol23/chapter/chapter-1-2/",
      "itemLicense": "CC0 1.0",
      "itemAuthors": ["Tim Krause"],
      "usedIn": "(previously src/content/lessons/pcc-esol-l1m1-greetings.lesson.json — removed 2026-10-03, superseded by se-a1-meet-someone)",
      "evidence": "docs/sources/evidence/pcc-esol-l1m1-greetings.h5p-metadata.json",
      "notes": "Conversation text (Hello / Hi / How are you? / Fine, thank you / Good. Thank you.) restructured into SE lesson blocks; one multiple-choice exercise derived from the original item's learning goal."
    }
  ],
  "externalAssets": [
    {
      "item": "English with Jennifer — 'Hello. How are you?' (YouTube AzES-nhQFzk, embedded in the source chapter)",
      "provider": "youtube",
      "originalUrl": "https://www.youtube.com/watch?v=AzES-nhQFzk",
      "embedSrc": "https://www.youtube.com/embed/AzES-nhQFzk",
      "rightsStatus": "embed-only",
      "reason": "Third-party video, not covered by the book license — embedding via the official YouTube player preserves the learning value while rights stay with the original holder.",
      "verifiedAt": "2026-10-03",
      "usedIn": "(previously src/content/lessons/pcc-esol-l1m1-greetings.lesson.json — removed 2026-10-03; embed no longer part of the curriculum)"
    }
  ]
}
