{
  "id": "american-english-everyday-conversations",
  "type": "LearningResource",
  "title": "Everyday Conversations: Learning American English",
  "authors": ["U.S. Bureau of International Informational Programs"],
  "publisher": "United States Department of State — American English",
  "url": "https://americanenglish.state.gov/resources/everyday-conversations-learning-american-english",
  "license": "Public domain — U.S. Government work (17 U.S.C. §105; cite U.S. Department of State)",
  "licenseUrl": "https://www.state.gov/misc/87529.htm#copyright",
  "contentType": ["dialogues", "audio", "pdf"],
  "levels": ["beginner", "elementary"],
  "subjects": ["ESL", "English language", "conversation"],
  "reuseStatus": "approved",
  "provenanceNotes": "Federal-government work authored by the Bureau of International Informational Programs — public domain per 17 U.S.C. §105 and the State Dept. policy 'information on State Department websites is in the public domain unless copyright indicated' (corroborated by Georgetown University Library's open-resources guide and Wikimedia Commons hosting the identical PDF marked PD). Dialogues 1-1..1-4 + language notes inspected: formal introductions 'It's nice to meet you' → 'Pleasure to meet you, too'; informal 'Nice to meet you' → 'You, too'; notes explicitly state 'Good night' is not a greeting (used when leaving) and that 'Nice to meet you' is the first-meeting formula. Role in SE Lesson 001: ADAPTED — supplies the response pattern for 'Nice to meet you too.' (composition disclosed in stage map) and the verbatim 'Good night.' distractor.",
  "verifiedAt": "2026-10-04",
  "verifiedBy": "Devin",
  "adaptationLog": [
    {
      "item": "Everyday Conversations ch.1 — dialogues 1-3/1-4 + language notes",
      "itemUrl": "https://americanenglish.state.gov/resources/everyday-conversations-learning-american-english",
      "itemLicense": "Public domain (17 U.S.C. §105)",
      "itemAuthors": ["U.S. Bureau of International Informational Programs"],
      "usedIn": "src/content/lessons/se-a1-meet-someone.lesson.json",
      "notes": "Used for the first-meeting usage note ('Nice to meet you' is what people say when meeting someone for the first time) and distractor 'Good night.' verbatim from the source's language notes. The 'Nice to meet you, too.' response is now sourced verbatim from ae-english-teaching-forum — post-re-audit fix removing the SE composition."
    }
  ]
}
